311,2,1,5,1,6,"I think the AI could help in efficiently organising a preliminary list of who deserves priority - but that a human officer should check through the list before approving it afterwards, because often records of good/bad behaviour what an individual actually needs ",7,"I don‚Äôt entirely understand AI, but I assume that it would work by examining records of behaviour in prison and offences as well as background information such as how long the sentence was and the socioeconomic background of the prisoner - picking up on key words in these records to order the prisoners in order of priority for extra support",6,"It is unbiased unlike human officers - but again, it also makes decisions entirely based on records and statistics, which could perhaps not accurately portray what an individual really needs after release",7,As said prior I trust the AI to help make the human decision more efficient - it could save time but I don‚Äôt trust it to make the final judgement,8,7,8,8,18,2,2,1,31,33,6
534,1,3,3,1,7,Having an impartial source that combines all the different factors should be useful for making correct decisions.,6,"I remember the factors that the AI takes into consideration, but I'm unsure of the process and how it weights these factors.",7,The factors used to make decisions seemed fairly comprehensive.,5,Without knowing how the different factors are weighted it seems possible that the decisions could be unbalanced.,5,8,6,8,34,3,1,1,32,6,6
280,1,3,3,1,9,"We cannot always trust AIs to make the correct decisions, even if they are programmed to do so. They are missing the ethical aspect of everything.",9,The description was clear enough.,7,I can't think of any other aspect the AI could consider. Except the humanity that the Lead Consultant has to bring.,8,"Again, we can never give 100% of our trust to a computer. At the end of the day, it's just a computer.",10,9,10,8,26,5,2,3,6,35,5
1287,1,3,3,1,6,An AI doesn't make mistakes and calculates while a person can be wrong sometimes.,6,"I am not sure about the details, but I generally know how it works.",6,"Personally, I think that it's a very objective way of decision making, however I am not sure if a non-human should decide about life or death of a human being.",7,An AI will make decision in an objective way. I am convinced that the AI will make less mistakes than a human being will make.,8,5,7,8,19,2,2,8,40,26,6
563,2,4,8,1,6,"A broader understanding of human specifics is needed, so you can't trust 100% and AI on decision making",10,Algorhytms,10,based on the data only,6,"Not really, would rely on a human supervision of the process",10,1,10,1,29,5,2,1,73,1,6
328,2,3,7,1,7,Helpful information which would be difficult to calculate by hand.,6,I understand the parameters but not for much weight it would assign for each parameter.,8,Likely to be unbiased and free from human error (if programed correctly),6,"To an extent but as it is a new way of working, I would want the results checked in some way",4,7,8,8,36,6,2,8,21,6,7
354,2,2,6,1,9,Sometimes there was very emotional reasons why on person might be need more resources. These can be very complex human emotions that the machine cannot understand due to the complexity of the situation. Therefore all decisions should be reviewed by a person,4,I think it be using data to make decisions ,10,Yes at the AI would have no preexisting bias or unconscience bias (although it may have the creators unconscience bias built in),8,Yes because I believe the decisions would on principle be fair. the AI removes some of the falls in human decision making (elimation of emotions for example) however this could also be seen a benefit that the AI does not have,8,2,8,2,25,6,1,7,25,16,6
337,2,2,6,1,7,I don‚Äôt agree fully as I don‚Äôt trust it to be fully accurate ,1,I don‚Äôt understand how it would make decisions ,5,It depends on what information they use to make the decision ,5,I don‚Äôt believe they can be accurate 100% of the time ,5,10,10,5,32,2,2,5,49,8,6
518,2,1,5,1,6,Lead Officer can make decision based on feelings ,5,"it's not really clear, but it should be algorithm ",3,not necessary,3,i don't trust AI on 100%,2,8,2,8,28,5,2,2,44,60,6
600,2,2,6,1,5,"Even though AI might be helpful in decision making, a police officer can't always relay only on that, in my opinion, it should only be used as a tool for guidance.",2,Its difficult for me to understand how AI is so advanced that it could make such decisions,5,"It depends on the case, I think it might be helpful, but sometimes not",4,I think I'm just not ready yet to leave such decisions in hands of artificial intelligence ,5,7,5,5,21,2,2,2,30,25,6
1084,1,1,1,1,8,"AI can manage loads of information fast and objectively, however humans have something that AI doesn‚Äôt, so, it is recommended to follow the instructions of the AI but keeping in mind that in some situations the final decision could be different considering the human factor that lacks the AI ",5,"I understand and have knowledge of the technology, but in this particular case I ignore the algorithm of decision of the AI",8,"The procedure is similar to what any human would do, but faster, easier and done by a computer. ",8,"As long as it is a tested algorithm, it is a very useful tool that can avoid a lot of problems in tense situations ",4,6,4,7,20,2,2,5,15,35,6
730,1,2,2,2,7,"If there‚Äôs something there than can help, it should be used but overall it should be the humans decision",5,I can make an educated guess as to the imaging techniques they use and how they assess the severity of injuries etc,10,"It‚Äôs fair, just not necessarily compassionate",7,"Kind of, I trust the to influence decisions, not make them",8,5,8,5,19,2,2,1,8,0,6
305,1,2,2,1,7,"I believe AI is a way to go, but it is not advanced enough to make decisions totally on its own",5,I don‚Äôt know enough about how AI works ,7,"I don‚Äôt have data to decide if it‚Äôs fair or not, but I trust people who make these decisions for hospitals ",4,I don‚Äôt think it is advanced enough just yet to make decisions on its own without supervision of human,7,7,7,7,34,6,2,4,59,59,6
203,2,2,6,1,7,The lead officer should have help to make the decision to ensure its the right thing ,4,I wouldnt know who should be prioritised and why ,5,Its their job ,6,Yes because thats part of their job ,8,8,5,6,29,2,2,3,50,50,6
248,1,3,3,2,7,"The Lead Consultant can use the AI to analyze the situation but, ultimately, the decision should be made by the person",6,I'm not sure what the programmed priorities are but I understand that it would analyze the situation and rank the patients based on need and urgency,5,The AI would not have access to the human factor,4,"I trust it to help with my decision but not to make the decision alone, simply based on data",7,7,7,4,31,6,2,2,14,55,8
702,2,3,7,1,6,It would help save time for them especially if the crime is increasing.,6,It bases the decisions on crime rates and types,7,I think AI should be considered as fair and accurate,9,Yes I do because they‚Äôre programmed to assess data properly,5,5,5,5,35,5,2,3,53,12,6
435,2,4,8,1,10,it takes into account many parameters objectively and is a good tool to help inform a decision alongside other information. ,6,i understand it weights the different parameters given to decide,8,it is objective based on given parameters. ,7,some input from pple e.g prison officers would help but i largely trust AI as it will rank without bias,8,5,7,4,25,6,2,9,60,0,6
225,1,4,4,1,8,It is easier to interpret the information based on measurable factors,8,Used data and associated information to measure importance and priority,6,It‚Äôs using raw data,4,It doesn‚Äôt factor in the human experience. We are not measurable by data alone,5,8,8,8,33,6,2,8,17,19,6
286,1,4,4,1,6,I do not think that AI should have full control of who is treated but can help to make an informed decision.,6,I understand how it measures data to come to decisions.,5,"I think the AI makes unbiased decisions, but not that they are 'fair'",4,I trust AI to analyse data thoroughly,8,6,8,6,38,6,1,3,9,1,6
463,1,4,4,1,6,"Although it would make the task quicker and efficient, it may not include all necessary factors",7,Takes all the factors in the graph to place patients in priority order,7,I agree would be quite fair based on the information in the graph ,7,"Yes, with most cases this would work ",10,10,10,10,33,2,2,3,50,0,6
344,2,3,7,1,7,It can process the information creating an unbiased descision ,8,It process all the data of the prisoners like time spent there there behaviour,6,There would be no bias and only uses the information given ,5,There is a level of humanity that must eb considered the the AI could not that should be factored in,5,5,5,5,20,3,2,10,33,0,6
474,1,1,1,1,8,"Yes, the AI can make the decision without any bias and it reduces the stress from the Lead Consultant",7,AI makes decisions based on the data it is fed. ,6,"Yes, it is fair. But i believe it can be rigged to a persons advantage ",8,"If fed accurate information, I trust the AI to make the decision",7,4,7,6,25,6,2,1,11,81,1
620,1,3,3,1,7,it will be more rational than a human so it will give a more logical response,7,It uses information on the patients from their history and current illness to work out who should be treated first,8,It is fair as it picks the logical order however its an A.I so would lack empathy on the decisions,7,to a point i do trust AI to make these descions but as it lacks empathy it feels a little wrong to let it make the decisions on its own,5,5,5,5,32,3,2,1,41,51,6
266,2,4,8,1,4,"I feel as though an AI cannot get a feel for a person's genuine actions and emotions, the lead officer can",4,I makes decisions based on facts and data collected ,5,"I feel like, again, it can't take into account the thoughts and feelings of a person",3,"It may be biased, or miss some information, or not have a system to detect specific characteristics of a person being released",7,10,7,7,21,2,2,3,50,65,6
220,1,1,1,1,6,It would take human error and emotion out of the equation. ,2,The survey has not informed me of this information. ,7,I would have to assume that this is true,7,"If the AI has been programmed properly, yes. ",3,7,1,7,23,6,1,8,53,41,6
1045,2,1,5,1,3,An AI can not necessarily discern if someone deserve a second chance,0,I've never heard of such technology before,0,An AI can not judge something so severe,0,That decision should be left to somebody with conscious and free flow thinking,8,3,9,4,27,5,1,8,30,20,1
383,1,1,1,1,6,This will improve the efficiency at which he hospital gets things done. The Lead Consultant can focus on other things,4,No information has been given on how the Ai makes its decision ,6,If all factors have been given to the Ai then the job can be done ,8,If there are routine check ups on the software on the AI,10,7,10,7,20,2,2,4,15,25,1
273,1,4,4,1,4,"As someone who would be very low on the AI as a priority it makes me nervous as a model, however it would speed up the process and in most cases I imagine be accurate",8,It uses a range of factors to create a ranking for people on the waiting list. ,6,In most cases I imagine it would be fair but would feel unfair to those who were further down the list. ,7,"I imagine AI can malfunction, however there can also be human error and I believe this would be more accurate than humans. ",9,9,10,3,27,6,2,6,40,9,6
316,2,1,5,1,7,I'm not truly sure it's a great thing but if they are short on man power I say do it ,6,I'm assuming It gathers into and compiles risk factors.. ,6,I'm assuming it's fair. Don't have anyway to know. ,5,I'll never trust AI to make a human decision. ,6,9,3,9,35,3,2,4,14,14,6
736,1,1,1,1,7,"With the use of the AI there might be a new perspective brought to light, that the Lead Consultant didn't think about before. In addition to that, the AI is only used as an additional tool for the decision making, it is not solely responsible for the final call.",4,"The AI was programmed by humans, that manually fed the AI with information and algorithms that will most likely be efficient for decision making. Other than that, I do not know much about programming or the flaws in the AI program. ",10,"It is fair considering it is objectively using the resources that it was given. If the programming wasn't fair, the decisions wouldn't be either, but that's not the fault of the AI.",5,I trust the AI to make decisions which will then be used to talk about and be considered by the Board of the hospital.,7,3,7,3,22,2,2,1,5,30,6
405,2,3,7,1,8,the AI will help gather the information into an easily understandable format and help to draw instant distinctions between various ex-convicts to help consider which need priority,7,we have been told that the AI makes decisions based on a number of factors / characteristics relating to each ex-convict and their crime(s),5,"the AI can arguably help gather data that is programmed into the computer, however it does not account for subjective matters, such as the convicts attitude to reform and what they have to say about how their prison experience has impacted them and what they are likely to do once released (and how credible they are) in the same way as a human could help gather this information and give their view.",5,"as explained previously, the AI can help make certain decisions, but I do not consider the data it collects to be sufficient to make any final decisions relating to an ex-convict",8,6,5,8,29,8,2,7,50,10,6
285,2,2,6,1,7,"Every situation is different and a computer might not always be able to take every detail into consieration so I think it can advise, but a person needs to go through and make those decisions with all of the data available.",3,I don't know what data is used to make these decisions but i can guess it uses these and makes a calculated guess of how likely they are to reoffend or need extra help.,5,I don't know how it makes decisions,4,I think there is still a long way to go before we can fully trust the intelligence of a computer the same way as the mind of a person,7,10,8,9,23,5,2,1,19,0,6
322,1,2,2,1,4,I don't trust the AI to be making these decisions because humans and medical situations are complicated.,2,"I don't really understand what information the AI is using.. I assume the projected outcome of the treatment is part of it, but what else?",5,"Considering that it isn't fair for anyone to lack treatment due to limited resources, I'm sure the AI's decisions are not any MORE unfair than the entire situation at the hospital.",0,"Humans and medical situations are complicated, I think a human medical professional should be making these decisions.",8,8,6,9,34,3,2,11,40,0,6
397,1,4,4,1,5,"It's hard to decide. I like the idea of an AI that uses objectivity to decide, but AIs are programmed by humans. Sometimes these biases are programmed into the AI algorithm unintentionally.",4,"I sort of understand. It sounds like it takes various factors into account (such as procedure, comorbidities, age, etc), and chooses based on the best outcome.",5,I am not sure who programmed this AI and what their biases might be.,4,I am not sure who programmed this AI and I am not entirely sure how it comes to conclusions.,7,7,7,7,32,5,2,8,41,0,6
232,1,1,1,1,5,It might be a good idea. Perhaps they should consult the AI but not entirely rely on it. ,3,It is not clear how the AI makes decisions. ,5,The AI has no sense of morality. ,4,I don‚Äôt perceive AI to have empathy. ,3,8,5,7,33,5,1,10,49,96,6
383,1,3,3,1,5,Every decision should be justfied,6,AI does adequate research,4,For everyone justice can mean something different,5,"Yes and no, I don't know what i would do if it concerned me",6,9,4,8,21,3,2,2,11,48,6
221,1,3,3,1,8,It will be quicker to work out who is priority but it should allow leway for error or emergencies or when the system may be down,10,Already use it at our place of work (NHS) tells us who is due an appointment so I understand how it works,8,There will be circumstances where it will be needed to over ride or exceptional circumstances but the system is fair ,8,It works on computer algorithms and is quicker at thinking than a human ,8,4,6,6,30,3,2,5,20,0,6
264,1,3,3,2,6,Grandpa based on straight back leaving out the human spirit and all that are valuable but that shouldn't pure fact alone should not make the ruling when it comes to The human condition,8,It takes all the solid concrete backed the numbers the figure is the times the what the who the where and uses that to make a decision,3,It's kind of fair but at the same time as I said The human condition is an amazing thing can change your heart,4,This is hard for me to answer I trust to make the right answer based on facts and figures,3,7,5,5,46,5,1,6,45,12,6
182,2,1,5,1,6,The AI seems useful but I wouldn't fully trust it.,1,I dont understand how the AI makes decisions.,8,An AI cannot be biased.,2,"I don't understand how it works, and I don't trust AIs. ",7,5,5,7,22,5,2,1,30,70,6
383,2,2,6,2,8,Artificial intelligence uses criteria that are not based on emotions or human input and are therefore unbiased. ,9,The AI has access to multiple databases that allow for decisions to be made with more information than a standard human can process at a time.,10,The AI uses multiple databases to make decisions and does not rely on human emotion or opinion to weigh it's decision. ,7,"As long as the information from the databases are reliable and factual, then the AI is reliable. ",10,0,1,9,35,3,2,6,14,0,6
527,2,1,5,1,10,It will save them a lot of time so they should use it to help prioritise people.,7,The AI makes decisions based on peoples circumstances ,5,There may be people who need the help more which aren't a high priority.,4,It should be based more on peoples current circumstances ,2,9,2,6,20,3,1,3,50,10,6
418,2,3,7,1,8,I feel artificial will not be biased but in some cases human emotion is needed especially if a criminal is remorseful,8,AI uses an algorithm based on past behavior to predict future behavior ,8,i think to an extent because it takes emotion out and is based on facts,7,"i do trust for the most part but human remorse can play a big part, not all past mistakes will be repeated and i feel as if AI will base an outcome on past behavior only not current change",7,8,8,8,31,2,2,2,60,81,1
237,2,3,7,1,1,because AI isn't reliable and can't replace human brain,0,It's not a person who can think properly,1,I'm not sure what can trust if AI is reliable,0,because they can't be reliable,10,10,10,10,32,5,2,2,50,1,6
242,1,4,4,1,9,"This would be an extension of evidence-based medicine, which I am in favor of. It reduces the human biases inherent in medical care.",5,"I understand the concepts, but not the underlying programming logic.",9,It's as fair as the people who set up the parameters and do the programming make it.,9,For all the reasons given in my previous answers.,4,8,4,8,65,5,1,11,50,1,6
243,1,2,2,1,6,the consultant can use the help of the AI for their decision making on which patients are on priority,4,not exactly all the mechanics behind it,4,i would imagine it is as it takes into consideration the facts ,4,i would human element to be invloved to (up to an extent),6,6,7,5,36,6,2,12,35,29,6
422,1,2,2,1,9,I think the AI would give usefull information about the patients. It would be easier to make decisions unbiased on human emotions.,7,"I understand it makes decision on data, but I am not fully understand the science behind it.",7,"I  think mostly it is, but it is purely on date, so I think we need the human element too.",9,I think it would be pretty accurate.,8,2,8,2,25,5,1,3,11,7,6
174,2,4,8,1,2,i dont think its a good idea. we need real people,8,im familar with it,5,dont know enough to say,1,they arent a real person,5,5,5,5,55,5,2,2,8,1,6
219,2,2,6,1,6,It will help to guide a decision but fundamentally a lead officer should assess each individual person,7,It will use a code that doesnt look at things individually,7,It is fair but not precise or evaluative of other factors,8,Yes but should still be looked at,8,5,7,7,21,3,1,3,20,1,6
384,2,4,8,1,5,because sometimes common sense and emotions are needed,8,I think I understand well,7,sometimes it's hard to say what's fair,7,I think yes but not all the time,5,5,5,5,19,2,2,1,50,0,6
293,1,1,1,1,9,The AI can analyze many points of data quickly to arrive at a decision that needs to be made in haste to save lives. There is also no bias in AI and bias could skew a human's decision making.,10,The AI will analyze preset data points and limits to arrive at it's decision.,10,If the presets for the data are accurate then the AI will use those points to make the decisions without bias.,10,"Aside from extenuating circumstances that the AI cannot account for, I trust it to use it's limits to arrive at decisions.",7,10,7,10,40,5,2,5,60,80,6
166,2,3,7,1,2,AI is not as good as a real person,1,Just don't understnad it,2,Where's teh heart?,0,It's not real,8,0,8,0,44,6,2,4,1,1,6
515,1,3,3,1,4,Doctors and human beings are the experts in their field. They could access the AI to backup their own decisions or to help with decision making. ,6,"It sure the criteria such as BMI, medical history and comorbidities to decide who to treat next.   ",0,"All AIs have in built bias, certain ethnicities have a propensity to certain disease such as heart disease, the AI may regularly overlook them. ",3,it will have in built bias and also may overlook unusual/acute circumstances,8,6,9,3,41,5,1,6,32,80,6
355,1,4,4,1,6,"While those at the hospital should double check what the AI prioritized, this crates less stress at the hospital and medical professionals can focus on giving treatment",7,I feel as though I understand what the AI prioritized when deciding who deserves early treatment,5,"While I would not call the AI unfair, there are still many factors it is unable to consider",8,AI has been in development for many years and I generally trust this technology,5,7,9,7,21,2,2,6,51,19,7
223,2,4,8,1,8,I think its the best way to make decisions without being biased ,8,I understand how it works ,8,It makes decisions the fairest way,8,I would trust it more than a human ,5,5,0,10,29,2,2,2,2,2,6
473,2,4,8,1,7,To help them speed up the work load but I also think I think lead officer should use his common sence to make sure AI is making right recomendations .,8,It looks like it has a set list it goes by first and the uses the prisoners dats to see if they match the highest prioriorties of  set list. ,5,I think AI cannot be fair itself but goes by the lst which is imputted by people and hopefully the people make the set list fair. ,7,I trust it to go by what its programed to do. ,7,7,7,8,45,3,1,5,40,0,6
627,1,2,2,1,7,"Since I don't know that much about this matter, it's hard to choose. I assume using AI can be very helpful in decision making, since it will look at the medical urgency. The decisions won't be made based of emotions (do I like this patient, does this patient deserves to be treated before someone else) or when it's hard for a doctor to tell whether someones condition is indeed worse/better than the other. So yes, it could be very useful. But I don't know how accurate this AI is. Since we are talking about people's treatment (a serious issue), I think the decision-making should not only be done by AI only. I think it could be a good method when it's hard to choose for a doctor or such. ",3,"I feel like I do not yet understand how the AI makes decisions. I have some assumptions, but I don't feel like I'm very up to date about this matter.",3,"When you look at my previous answers, you can see that it's hard to tell for me. Because what is fair? Every human being deserves treatment when they need it. Therefore, I feel like the decision-making shouldn't be done by AI only. ",4,"I suppose a lot of research has gone into it, but I would like to know more about the method before trusting it. How fault proof is this system?",9,0,10,0,25,5,2,3,2,0,6
530,1,2,2,1,7,"The Ai will not have any emotional stake in the decision making and only prioritize individuals that really need the help. However, I put 7 as AI can sometimes malfunction or ahve problems so if a decision by the AI is clearly not logical then I think the lead consultant should make the decision.",8,"I believe I do undertand, it takes medical information about an individual and uses this information to decide who prioritize with the hospitals resources",9,"I think it does, it takes data from a logical and unbias way and uses it to prioritize, unlike humans who are most likely to use emotion",8,"I do, if the AI has been tested and is working well",8,6,8,7,20,5,1,1,50,3,6
362,2,2,6,1,8,This decision is a judgement call for which an AI can process a number of variables using pre determined metrics. It should aid in these decisions. ,8,I understand how AI would be programmed at a basic level. it would be parsing data for certain quantifiable information and running this through formulas to gauge the required results.,8,It would not have biases beyond that which the programmer has installed. Short of data showing it consistently made the wrong decisions I expect it would be more impartial than a human. ,8,Overworked police departments with stressed human staff are not likely to make better decisions than an impartial AI. Humans would be allowed to focus on more complex or nuanced cases.,6,9,6,9,35,5,1,3,25,1,6
924,1,3,3,1,7,"Because based on algorithm, AI has the better position to make such decisions.",7,Because it's based on algorithm which is a good scientific method.,7,"Yes, it follows a process or set of rules to be followed in calculations or other problem-solving operations, especially by a computer.",7,"Yes, because it follows a set of scientific rules.",0,6,0,10,31,6,1,6,20,20,1
