340,1,4,4,1,7,"AI considers all factors without risk of an emotional link prioritising someone, but all cases should still be reviewed individually",6,The weightings show which factors have the most impact,5,Cases aren'r considered on an individual basis,5,"There is always some scope for outliers, which could be fatal in a hospital ",7,4,8,7,25,5,1,5,64,39,6
640,2,4,8,1,8,There will be less mistakes made due to the set of algorithms that aI has,5,It thinks on its own and uses algorithms to make decisions ,7,It does not base the decision on only one factor,8,Less chances of human error. Also it won‚Äôt make decisions based on emotions,1,2,1,2,28,5,2,5,80,30,1
217,1,1,1,1,5,I‚Äôm unsure. I think it would be good if it can access all the information quickly rather than doctors looking through everything. But it could make mistakes.,0,I don‚Äôt understand how it works,1,I don‚Äôt know. But I presume it would. I can‚Äôt be sure,3,If experts choose to use it yes as I trust them. However I don‚Äôt personally know.,5,6,5,5,22,5,2,4,19,0,6
686,1,3,3,1,9,"With the use of AI, the doctor would be able to make better decisions which will be tailored to meet the individual needs of the patients",8,"It makes decisions based on algorithms generated from data which includes gender, food choices and lifestyle",9,AI makes decisions without any emotional sentiments,8,AI doesn't lie,8,3,9,7,37,6,1,11,81,75,1
1219,1,3,3,1,8,The Lead Consultant should use the help of the AI to make decision on which patients should be prioritised to receive treatment first.,8,"The AI followed these procedures: reason for procedure, comorbidities, waiting time, age, sex, BMI, previous health interventions, previous hospitalisation, and current medication.",7,The algorithm of the AI makes it easy for it to make the best decisions.,8,The AI will not do any preferential treatment,5,7,6,9,36,6,1,12,71,92,1
386,1,4,4,1,7,To make decisions easy and faster,2,I dont understand how AI make decisions,7,TRUE,7,I trust AI decisions,4,8,4,8,29,5,2,11,53,49,1
231,1,3,3,1,9,The AI also gives its verdict impartially as it has no feelings towards the individuals patients needs,8,It filters down a variety of different needs the patient may have and gives an overall summary of how long they need to Wilson which is then categorized by urgency  ,10,I believe it‚Äôs fair as it is an impartial point of view,10,It is programmed in order to make the best decisions for the hospital,4,4,9,9,24,2,1,5,85,0,6
447,1,4,4,1,5,"I think it all depends on personal circumstances of each patient,  i believe the AL will help narrow it down but once narrowed it should be looked into in more personal detail.",1,I have no idea,5,"I dont believe it to be fair nor unfair, the AL used technology which whilst it helps it can not look deeply enough into patients personally.",5,"Again, i dont think it can fully make the decision,  only help towards a doctor/consultant/surgeon making a final decision.",8,5,5,5,37,2,2,3,50,0,6
435,1,2,2,1,5,"Lead consultant has years worth of experience, AI can be suitably programmed, both can make mistakes  ",4,Algorithm ,8,Driven by facts not emotion ,5,Can malfunction ,10,1,10,1,35,5,2,5,50,50,6
220,1,4,4,2,3,Priorities are more personal than AI can determine,5,Based on lowering wait times overall.,5,Although fair it doesn‚Äôt take into account those factors outside scope.,4,In some cases yes.,5,1,2,2,48,2,2,8,15,4,6
685,2,1,5,1,4,I do not trust that AI is capable on making accurate decisions in this scenario because it may lack human empathy,7,It uses historical data supplied to rank candidates ,1,Human being are emotional specimens they are capable of remorse and change at any moment and their decisions do not always reflect their true characters,1,AI only makes decision on what is on the record and cannot read true human intentions,2,8,8,2,27,5,1,2,61,71,1
218,2,3,7,1,5,depends how advanced the AI system is,7,The considered variables are listed so its clear,5,Not enough information ,5,Not sure,1,1,1,1,31,5,1,2,50,50,6
362,2,3,7,1,7,The AI will have all the relevant information within its database and will form an opinion based on data rather than emotions towards the ex-prisioners.,9,AI uses the information it has within its database which has been inputted by the officers based on the records of the individuals and the AI then uses that data to make the final decision,8,AI makes the decisions based upon data rather than emotion.,6,As long as the data has been inputted correctly then the decision can be trusted,5,5,8,8,22,3,2,3,40,0,6
1129,2,2,6,1,7,It should because it uses the latest learning technology,6,It is an inbuilt cognitive system,4,Fair,4,It has latest neural technology,7,4,8,6,35,5,1,6,52,83,1
260,2,2,6,1,7,as it may not always be right,5,unsure,5,not always looking at the bigger picture,5,unsure,2,8,2,10,41,2,1,3,19,8,6
433,2,1,5,1,5,I've no idea how the AI works. Does it understand nuance? Or just numbers? ,1,"I'm assuming it compares data, but I'm not sure",4,I couldn't say. I'm sure it's going to get some things wrong. But admittedly i don't have the most sympathy for what I'll assume are mostly guilty parties,4,"I'd be unhappy if it were deciding my fate, but it's no coincidence that I've never been in that situation",5,5,5,5,40,3,1,8,30,2,7
604,1,1,1,1,8,"Yes, it would save time and be more efficient for the AI to gather all the information of the patients and organise them into a list of priority. However, I have no given a 10 as the consultant should still have a look over the list to look at things not considered by the AI or any malfunctions to double check. For example, someone may have a less serious health issue by a margin but their symptoms maybe more severe and more painful so the consultant should double check the AI's list. ",4,"I understand to some extent. I believe the AI I will consider data such as pain factor, risk to life, age and then create a list. I am not sure how. ",7,"The AI will make decisions in a much more objective manner as there will be no bias involved, however, it may not be able to consider some factors that are not quantifiable but are important none the less. So the decision will be very fair and objective, although some things have to considered by the consultant. ",6,"I do trust the AI to make a list of prioritised patients in order, as long as a consultant goes through the list to make sure the patients do not have anything else that has not been considered. ",9,1,9,1,19,5,1,1,60,80,4
403,1,3,3,1,9,The use of AI can save time by giving clarity on the background/current state of a patient. AI programmes are strict and do not have room for ambiguous interpretation so the data can be trusted.,9,The AI has access to all the patients data and using programmed calculations will make a recommendation on prioritisation of the patient. This will then be fed to the consultant by the Ai for the consultant to make a final decision.,10,"AI looks at strict parameters and data and cannot discriminate against a patient, providing a level playing field. ",10,"Trust should be placed in the AI system to do exactly what it has been programmed to do, any concern should be placed with the programming team, not the software.",4,2,7,9,29,5,1,7,30,10,6
153,2,2,6,1,5,There has to be a human element - an AI can act as an actuary but local human knowledge will always need to be factored in. ,2,There hasn't really been enough detail given. ,5,"The assumption would be that because it makes decisions based on - I assume - statistical analysis, that it is de facto ""fair"". ",5,"Yes, but I would want them to be reviewed. ",5,5,5,2,40,6,1,4,40,2,2
240,2,2,6,1,5,"If the AI is good enough, it should be used, but if not it could provide misleading recommendations",0,No information has been given to me,5,I don‚Äôt know this,2,"It depends on its decision-making process, which I don‚Äôt know",6,2,10,7,30,7,2,4,0,28,6
261,1,1,1,1,1,Human element is needed in this type of decision.  There is too much room for error.,2,I know that there is an algorithm but I don‚Äôt know the specific criteria.,3,I haven‚Äôt seen the results of the choices that the AI has made.,2,I would not trust anything but humans to make this decision ,10,6,1,6,33,6,2,6,5,83,6
126,1,1,1,2,6,It is important to inform ,3,To an extent ,5,Yes,4,Yes,5,7,3,4,23,5,2,1,44,60,8
367,2,4,8,1,6,The AI can be a good guide but I believe a human will be able to see elements the AI can't necessarily see (ie what is good behavior and what isn't?).,7,The AI would have been created with specific factors to give the best results possible,8,"The AI will usually be fair I believe as there is not human feelings involved, though it was created by humans so there might be some unfairness involved.",6,"Yes, I trust the AI to give primary ideas but I think a human will need to confirm the results are accurate.",7,6,5,6,26,5,2,4,45,0,6
321,1,3,3,1,5,It would help with shortlisting the patients but should still be checked manually just in case of mistakes,4,I understand the basics but not the mechanics ,5,"In theory it makes decisions on facts, but there isn‚Äôt the human factor ",5,"If I was waiting for a procedure and it put me at the top of the list I would trust it, however if I was at the bottom of the list I wouldn‚Äôt, it comes down to self preservation ",4,9,8,8,39,3,2,4,51,6,6
501,2,2,6,1,0,The way AI functions (as I understand it) is that it still get's its infotmation fed by real humans. Humans that have biases and are fallible. The AI after being fed the data will not be. Insofar I would rather have a mixed bag of humans that a ruthless AI.,8,The data that informs the AI's decision is fed to it by humans. It might collect data points about what type of criminal offenses rehabilitated easily in the past and might take that into account for example.,5,"Depends how you defind ""fair"". The AI would not use a preferencial system. But it might be very well informed by preconceived biases and would not be fair.",0,For the same reasons I mentioned in past answers.,3,3,3,3,20,2,1,2,0,0,6
254,2,1,5,1,3,"I would be worried that the AI is too data-driven, and since these are very individual cases, unique mitigating factors may be missed, which is unfair on the ex-convicts.",6,"My understanding is that the AI makes decisions based on data and previous patterns of data, or patterns of data programmed by humans.",3,"Whilst the data may be accurate, I believe that mitigating factors may be missed, or the programmed data may include biases, which are unfair.",3,"I do not trust the AI to take into account everything that a human would when making these decisions, therefore I do not trust the decision very much.",9,4,7,6,27,6,2,5,2,10,6
396,2,3,7,1,8,They are able to obtain all of the facts from the AI. However they will still need to have their own information to help with their decision. ,6,AI collects data from given databases and reports. It then converts this information into the format that is desired. ,5,AI does not have any emotional feelings do effect their decision. It is matter of fact. However these are numbers that were input and therefore if these numbers were input incorrectly then there will not be enough information to make an informed decision. ,5,As per previous answer. The information the AI is using could have been incorrectly input and therefore if will make it‚Äôs decisions based on this ,1,8,8,2,33,5,2,3,50,65,6
446,1,3,3,1,0,"AI is not reliable, and in the instance of life/death situations - the matter should rely entirely on human decision. ",5,"I selected halfway because I am not entirely sure, although I know a bit. ",0,"The AI has one purpose - to work solely on data - whereas a human has the better judgement because they can look at perspective, not everyone might have the right data on the medical files for example.",0,"I don't trust AI to make important decisions about health because I think AI has too much room for error, whereas if a human was making this decision then humans could discuss more factors which may not be taken into consideration when working from data alone.",9,10,1,9,29,3,2,4,70,80,6
343,2,4,8,1,5,I understand how it could be helpful in a quantitative sense but surely there is a human level here which AI can't measure but which a Lead Officer could consider.,8,I think I understand from this that the AI has access to data relating to each prisoner and is able to quickly show this in quantitative terms ,5,I honestly don't think I know enough about it to be able to judge this,8,"I trust that the AI will make decisions, yes, but I don't believe it should be used as the sole indicator of what someone should be assigned in terms of resources",9,2,8,2,25,5,2,2,50,60,6
345,1,4,4,1,3,"There may be factors more complex that the artificial intelligence does not comprehend. In some senses, it does not seem right relying on that.",8,I know the factors it priorities when making decisions of which patients should be treated first. I was still a little confused. The list does not seem exhaustive either.,5,I think there will be many factors beyond my knowledge that the AI has not considered.,2,I would trust a medical professional more.,6,7,5,6,28,6,2,2,14,20,6
663,1,2,2,1,8,"I don't think that AI should be the only factor in decision-making, but I think it would be naive to ignore a resource that can provide a different perspective. The lead consultant should be using all the resources they can to make such an important decision.",5,"I believe I understand in general how AI works in terms of collecting and analysing data. However, I'm not sure how exactly it would prioritise patients in this particular case.",5,"I think the way AI makes decisions is truly logical, but I think fairness needs to be more than pure logic. ",2,I don't trust the AI to make the decisions without any other input from humans on such a critical issue. ,8,8,8,8,25,5,2,5,30,14,6
470,1,4,4,1,6,It would save time to get a short list,6,Ai takes all variables into consideration ,5,Computers dont understand fair,5,"To get a short list yes, human should decide there after ",5,5,5,5,54,3,2,2,49,0,6
323,2,1,5,1,8,The use of an AI can accelerate the process which can be useful in a situation where resources are limited.,5,I understand it uses a certain algorithm based on information provided by the police database however there is no specific information on the process.,3,It can be programmed to be quite fair however I believe the people in the police department should make the final decisions based on their experience.,3,I believe it can be useful to limit the pool of candidates however I do not believe it should make the final decision.,6,10,5,10,29,6,2,6,13,1,6
356,2,3,7,1,8,"yes, i think the AI can never make mistakes",6,using the AI will not be that hard,8,"absolutely yeah, it makes no mistakes",10,"i trust it, simply because it is AI",3,5,4,3,33,6,1,4,80,51,6
1153,1,3,3,1,6,The AI will not be biased,6,The AI uses basic algorithms,7,The requirements  considered by the AI will determine the right patient that needs urgent attention,7,It procedures are clear and understandable,3,6,4,6,29,5,1,6,81,70,1
348,1,3,3,1,9,It is much quicker and based on facts not personal feelings ,9,It assesses all the information and bases the results on that,10,It is based on facts not personal felings,9,AI isn‚Äôt always perfect but mostly so,1,5,1,9,52,1,2,2,50,0,6
486,2,2,6,1,5,I am not sure because I have not seen before if an AI is used for decision making and this is an important decision to take.,7,"As far as I know they use deep learning so AI recognises people's face, voice etc and learns people's reactions, emotions etc through web-based systems",5,dont know,5,as stated before not sure,8,7,7,6,28,6,2,4,50,65,6
698,2,4,8,1,8,"I am working as ML software developer and I know that it can determine the best algorithm based on statistics, not emotions or other human ""weaknesses"".",10,As I said before I work at this field,9,"It all depends on the data you're working on, but I believe if in this scenario you put enough attributes and examples Ai will make fair decision",7,"I trust this algorithm, but I don't trust people who would make interpretation of this results",2,8,8,6,24,5,2,2,36,76,6
231,1,2,2,1,4,"AI doesnt look at the mental facet of this all, its based purely on the facts, not on the emotions.",7,"Using a stream of facts, the AI is capable of making decisions in everyone's best interest",7,"Highest chance of survival gets priority, which is fair",6,"I do, however it should never take them alone",1,2,1,4,20,2,1,6,63,11,6
281,1,3,3,1,3,"whilst the AI can provide concise and clear information, I don't think this alone should be used. A lead consultant should see everyone on a case by case basis and make a professional judgment ",7,The AI collects information from a variety of factors to rank the patients in order for who needs treatment first. ,5,"By looking at data/scientific information the AI is not assessing people or their life circumstances in my opinion which could be seen as more fair than if that was taken into account, but human nature will always play a part and you will want to help those you feel are most in need ",2,I am not sure as it seems like a new technology and there is little evidence of it being successful ,10,10,10,10,25,6,2,3,60,20,6
275,1,4,4,1,5,I think that this doesnt take into account emergancies and the hospital should already have this system in place,6,yes it seems computerised but what if it makes a mistake,8,as much as i disagree with AI it did have a good fair decision making skill,2,No i do not. It makes us just another statistic,6,10,5,5,28,3,2,2,33,13,6
552,1,1,1,1,10,An AI won't be bias towards making a decision while we are all humans we can logical reasons that are biased.,10,AI  augment human intelligence and enables a smarter decision making. ,10,The output presented by an AI are independent of sensitive parameters,10,Yes I believe it's the only way to avoid biasness in decision making,9,7,10,10,23,2,1,1,15,96,1
272,2,1,5,1,5,Firstly AI can be biased based on who helped develop it so we would have to know that to know whether any potential biases have affacted the development of the AI that may discriminate against marginalised groups.,2,We need more information to be able to understand how it determines who to pick,5,we have no way of knowing without being presented a dataset and the AI's decisions,5,It depends on who developed the AI,9,9,9,10,27,6,1,8,5,40,6
444,1,2,2,1,2,The consultant needs to think of the individual as a whole not just rely on AI,6,AI will make decisions based on information it is given.,7,"It's fair if it is programmed not take into account sexuality, ethnicity etc., and bases decisions purely on medical need",0,Not at all. I would much rather a human/panel made these decisions.,8,8,8,7,49,3,2,2,51,28,6
693,1,2,2,1,7,"I think AI would be useful in narrowing down and filtering out irrelevant data or prioritizing the top 50% of patients who require an emergency appointment based on a given criteria, however I then think the use of a fully qualified professional doctor should utilize their experience and training to decide who to prioritise from that 50%, that way there is less change those who may fall into a moderate emergency that are actually high emergency would be missed. There may be information outside of the criteria accounted for by the AI that could mean life or death however this would be missed.",5,I think decisions are made based on the answers to pre existing criteria and using previous outcomes to determine future outcomes. The AI can only use the information given to it to predict how to come to the most suitable decision.,5,The information you provide the AI to make future decisions will reflect the outcome. The initial algorithm can be programmed to be biased to a specific outcome.,5,I do trust AI to make decisions of moderate importance. I think they can make decisions quickly and free from human error however I would like to know the criteria that the decisions are based on ,7,9,7,9,26,6,2,4,50,13,6
684,1,1,1,1,8,because it will show level of competency and give accurate report,8,it collect the data of the patients,8,it gives room for fair decision ,10,it gives best decision base on honesty,2,3,7,8,34,6,1,8,12,72,6
312,2,2,6,1,6,"It could be a serious help, but should not be the only source",5,"I think it will make a prediction based on the crimes they've commited, their behaviour when imprisoned...",6,"It has no personal bias, but on the other hand it can't predict human decission making",7,"The decisions have to be made either way, maybe it's best to have the help of the AI as an extra source.",8,6,8,4,23,4,2,2,41,16,6
492,2,4,8,1,7,The information is details,7,I think its follows the algorithms ,7,"Yes, there is no bias and no emotions ",8,"Yes,i trust the AI because of it non bias",5,8,6,9,26,5,1,11,49,63,1
207,2,4,8,1,10,AI cannot determine the nuances of human characteristics that could outweigh other demographics,5,I don't really understand beyond it ranks certain variables as more valuable than others,0,The way AI makes decisions is arbitrary thus not fair,0,AI is not a human and cannot understand the complexities of each individual situation,0,0,0,1,31,4,2,3,2,1,6
250,2,1,5,1,7,"you get more data in less time, but the decision should still be made by a human",7,based on data,5,depends on the reliability of the data,5,depends on the data,2,2,2,2,25,5,2,3,33,1,6
716,1,2,2,1,10,The Al is used to decide on which patients would be treated with urgent medical procedure first.,9,Al is used to make decision because of limited resources.,6,It attends to critical and urgent conditions first.,9,It must have be tested and trusted.,1,2,9,9,34,5,1,6,11,82,1
238,1,2,2,1,6,I believe that humans still can evaluate the situation better but the Al could help.,0,I have no idea,5,Probably,3,I would rather trust a human doctor,10,3,10,3,18,4,2,9,28,40,6
322,1,4,4,1,7,The AI was programmed to help in this task,3,I would need a full explanation of how the AI works,5,It was build to be help those who are in most need,7,Beacause I trust the engineers that build the AI,6,8,5,8,21,5,1,5,25,5,6
303,1,1,1,1,10,AI knows better and it only cares about the facts,10,That's the best way to do that,10,It's fair because it compares people with different data,10,Definitely more that doctor,0,10,0,10,20,2,1,1,0,0,6
471,1,3,3,1,7,"Although doctors are professional and take everything into account, they could be conflicted by emotion whereas AI could determine priority cases based on history and outcomes rather than emotion potentially blurring decision making.",7,Algorithms and expected outcomes will aid this technology to choose based on probabilities and previous outcomes.,6,The only area the AI could be unfair would be cases when people with a low chance of survival but beat the odds... AI would not prioritise these people,8,Technology based that takes everything into account and has algorithms based on previous cases etc would have a trustworthy decision in my opinion.,1,1,5,5,30,3,1,3,20,2,6
348,2,2,6,1,5,I would need to see the research after a few months of decisions are made.,1,I don't know anything about AI.,3,It will likely be the only fair way based on the number of people to choose from.,3,It takes the humanness out of decisions.,4,4,4,4,26,5,2,5,78,83,6
1062,2,2,6,1,10,Artificial intelligent AI helps to inform decision makingwhich can be use by lead officer,10,Artificial intelligent AI helps in making decision on a particular issue,9,Artificial intelligent helps in making fair decision of a particular crime issue,9,I really trust AI in making decision because of the fair decision making,10,10,9,9,36,6,1,9,89,100,1
391,2,2,6,1,7,"it can be useful to an extent, since i think humans are needed to fully understand the offenders needs. AI can only be useful in terms of statistics rather than case-by-case",6,"it takes in information from previous cases, and uses that info to make decisions about future cases. i do not know if there could be a bias, since it depends on the circumstances (ie financial gain/strain) of the previous cases",5,each case  is different and shouldnt be compared with/judged by other cases. It is more complex than just using statistics,2,it's too dangerous to let AI make these decisions- they need humans to treat each case as individuals,9,9,2,6,20,3,2,5,10,9,6
259,2,2,6,1,10,Because is the best in making decisions,8,It will judge absolutely,8,It won't make wrong decision,10,Because it will be the right decision,9,10,10,10,37,7,1,12,21,86,1
377,2,4,8,1,5,I am neutral about this as  their should be other research also made in order to make a informed decison,0,i am not to sure about AL decision making ,5,It takes lots of things into consideration,4,Not completely as it make not show the true potential of one ,4,10,5,10,20,3,1,1,51,100,7
364,1,1,1,1,8,"Ive been already working on similar software for a disease diagnosis, it speeds up whole process, but still there is a check up needed",10,its all about machine learing and processing loads of data,9,"its again based on data, so its has no emotional or personal issues in it",9,"once again, its data based but it can still be wrong sometimes",9,7,9,7,34,5,1,5,25,0,6
442,2,3,7,1,6,to come with all the necessary information,6,collects information from large sources,8,involve everyone in decision making,10,convinient decisions,5,5,5,5,26,5,1,1,60,32,1
327,1,2,2,1,10,The AI has no emotions that would hinder judgment.,7,I have a decent understanding of how algorithms are involved in decision making.,5,"""Fair"" is extremely subjective.",5,"It is not infallible, but still is a useful springboard.",5,0,5,0,40,3,2,4,0,0,6
