313,1,4,4,1,0,I don't think treatment priority should be based on the type of procedure required or the gender of a person. It should be determined by how medically unstable the person is only.,8,It determines the priority of patients using an algorithm with certain criteria.,0,I already explained.,0,"No, because the criteria doesn't make sense.",5,10,10,8,30,5,2,3,50,50,6
197,2,1,5,1,3,How will the decision be made though? Seems a robot might not take all facts into account. No empathy. ,0,I haven‚Äôt been told. ,0,How would it be fair?,2,There must be some evidence to use an algorithm. ,10,10,8,10,27,6,2,4,19,11,6
349,1,3,3,1,10,the ai seems quite nice and should be useful with a human making the last decision ,10,it takes in consideration all kinds of information from the patient to reach its decision,10,doesnt takes into consideration things that maybe an human would,10,It seems decently safe,3,10,3,10,28,4,2,4,48,0,2
353,2,4,8,1,10,The AI might cover information that is missed by a lead police officer,4,"I don't understand how the AI makes decisions, but I understand that the information provided by the AI is credible and reliable.",10,I know the decisions made by the AI is unbiased and based on logic and critical analysis.,10,I trust an AI to make these decisions because I know the information provided is reliable and based on facts rather than opinion.,4,10,4,10,25,5,2,4,5,4,1
279,1,4,4,1,7,"Well, sometimes other factors may over-ride the computer sim",5,Some factors are weighted above others,2,Not really.  Its not always that simple.  Its not black and white,1,It does not take account of human factors,8,5,1,9,56,2,1,6,75,24,6
314,2,4,8,1,6,The Lead Officer should certainly use the AI to inform their decision making but should not rely on it completely as it does not take into account every single risk factor.,3,I understand the basics such as the factors it takes into account but not the finer details.,5,Some factors may not be considered and it may have serious implications for an individual's life when used in this way.,7,I do not see why not.,6,8,6,8,21,3,2,12,40,25,6
376,2,3,7,1,10,The AI can produce help and advice but the final decision should be up to a professional human ,6,Some of it is clear but also part of the process is confusing ,7,It using all the data it has available to it to make the best possible decision it can with the given information ,4,I would rather a professional human make the decisions,0,10,0,10,18,2,1,3,50,70,6
357,2,2,6,1,5,"To some extent it is useful to make use of statistical analysis and large bodies of research which the police force may not have access to in the same way AI does. This could reduce re-offending. However if the technology is not developed properly, over-reliance on the technology may result in decisions being made which are inhumane.",2,"I know a small amount about deep learning/neural networks etc., but not sure to be confident about how the technology would be applied in this situation",7,"It is fair in the sense that it won't be biased by emotions, but it may still be influence by the biases of those who developed the AI",3,"I would trust the AI to helpfully advise, but not make the decisions unchecked",7,3,6,4,25,5,2,3,1,50,6
331,1,2,2,1,10,If you're tasked with life and death decision I don't believe that you should base your decision off of one thing,7,It takes different streams of data to make a decision,7,Because it's a computer I suppose it won't be biased or have any attachments to a certain situation,7,"I think I'd need someone to oversee the decisions and get another opinion, especially at the start.",8,8,8,8,20,2,2,1,20,50,6
371,1,3,3,1,4,I‚Äôm unsure if an AI would be able to evaluate every necessary factor,6,The AI uses the information it has of each patient to decide which patient requires help first,3,An AI doesn‚Äôt have empathy and can‚Äôt take into account factors that a human could when making important decisions.,4,I would trust a human much more to make these decisions,8,5,5,6,23,4,1,5,30,10,6
426,1,3,3,1,6,Might be generally useful but such a matter of fact way to make such important decisions doesn't sit well with me.,8,Uses information about your general health to make a list and prioritise who 'deserves' treatment.,6,"Probably I know that it is, but human emotions make me feel uncomfortable about it. Everyone should receive the healthcare they need.",7,Using facts the AI can't make judgements on it's own using skewed opinions.,9,7,9,7,35,3,2,4,24,7,6
409,1,2,2,1,7,"An AI will make decisions that are likely to mean more people can get help, whereas a human will have other interests and are less likely to make optimum decisions. This would also free up more man power",3,I have a little understanding of neural network AI s,3,"The AI will do the thing that'll help the most patients I imagine, which may not be the fairest thing to do",6,"Yes, since AI will make optimum decisions based on the situation, perhaps this could then be verified by a human to make sure it isn't totally unfair",3,7,7,6,20,3,1,6,48,11,6
158,2,1,5,1,8,I think AI would definitely help but a human needs to double check it if it gets it wrong,8,I dont know the workings completely but I understand pretty well how AI makes decisions,5,fair is a vague word and depends on the person,8,yes with a human override,10,10,9,10,22,6,2,5,81,6,6
405,2,4,8,1,8,i think humans should use AI only as an addition. a person should be the one to decide and olnly use AI as a help for decision,5,i kinda have a grasp on how it works,4,not always. sometimes AI includes the biases people have towards other people (mostly regarding bipoc),6,overall yes,7,7,7,7,37,6,2,6,10,3,6
315,1,1,1,1,5,It depends on what basis the AI make the decision or if it's completely random. It's slightly unethical to allow a robot to chose but also good in the sense that it relieves the consultants of the choice,0,I don't know how the AI choses which patient gets the treatment,5,I selected 5 as I am unsure of how the decisions are being made.,3,Same as previous answer,3,7,0,10,27,4,2,7,1,0,6
548,1,4,4,1,6,a computer can be used to help forming a decision but ultimately humans should make the final decision based on education and professional opinion,6,Ai uses computer data only to make decisions,4,Ai uses computer data only meaning it cannot use emotional reasons,5,somewhat,5,10,6,8,40,2,2,4,46,1,6
150,1,2,2,1,7,It would make the most fair way,5,I understand it uses patients information to make the decision ,7,It makes it fair but prioritising the most in need ,4,I trust it somewhat,5,6,5,9,25,2,2,3,40,1,6
1162,1,2,2,1,9,I think computers would be good at triage management and would better handle larger numbers and not lose track of data.,5,I understand the basic principles but the math for algorithms is beyond me. ,8,"Triage management can be unfair. AI by itself would be just a tool but with limited resources, some may die. Maybe the fairest decisions would be the decisions that would be most consistent. AI would help with that.",8,If you had limited time and personnel you might want to keep working and trust AI for more of your decision making. You would still want to check the criteria for making decisions and verify the basic data and output.,3,7,4,6,69,5,1,8,40,80,6
418,2,3,7,1,6,"The AI have put together many pieces of information to be able to come up with a decision, therefore the Lead Officer should take into consideration the AI oppinion ",7,the AI analyses data and provides information from a wider viewpoint,7,they go off real data and sources to form their decisions rather than bias,7,"I think so, because as i said before bias in the decision is unlikely. information used to form the decisions takes out of account who is involved and what the crime actually is",2,9,4,9,20,2,2,3,40,55,6
424,2,2,6,1,6,The results from the AI should be taken into account but the final decision should be made by a human.,4,I know it uses a neural network and machine learning but I don't know what it prioritises or how it makes the decisions about the prisoners.,5,I don't know - it depends on whether there's a bias in the system.,3,I think the AI could easily not take everything into account or prioritise things incorrectly.,7,6,6,8,18,3,1,3,10,0,6
224,1,4,4,1,7,Based on the stats,7,I do but also they may need to prioritise who has been waiting the longest too,8,"Fair from the chart, maybe not fair on the patients waiting times",7,I don't see why not,4,6,6,7,28,3,2,4,24,0,6
278,1,2,2,1,9,I think it is very hard to make a non bias decision especially if you know the patient personally.,10,The AI takes in all medical information into account to make a decision about who to prioritise for treatment,10,The AI decides who more urgently requires treatment which is the fairest way to decide who gets treatment first as it could be life threating,9,I'm sure it would be testing to a high standard so I would definitely trust the AI to make an informed and accurate decision,8,6,8,6,30,2,2,4,32,0,6
410,1,1,1,1,4,"The AI may be able to objectively assess the conditions of the patients without humans' bias. However, the Ai itself may be built upon biased information so might also have a skewed perception. Thus, the consultant might used the AI to inform their decision, however, the AI should not have the final say in the patients' treatment.",2,I have not been informed about how the AI makes decisions in the interests of the patients.,3,"The AI may use objective quantative data from the patients, however it is hard to quantify abstract conditions such as pain levels in order to make decisions. Thus, the AI might not always be fair.",2,It is somewhat hard to trust the AI as I do not know the data it processes and if it is truly objective.,3,6,3,6,18,2,2,4,1,24,5
407,1,4,4,1,5,I trust the judgement of the doctor over the AI.,6,It comes to a decision based on the data-input and variables in it's programme. ,3,"Is it fair? It is as 'fair' as it's programming, which is biased to the decisions made by the programmers. ",2,"In some instances, I'm sure it is very helpful. But there are many variables to consider, which I believe only a trained and experienced human would be fully able to make. ",5,10,5,10,43,5,2,3,19,19,6
161,1,3,3,1,8,AI is very reliable,8,rational,9,behause it is based on facts,5,its not human,6,4,6,4,20,2,2,1,9,3,6
328,1,4,4,1,8,It would save a lot of time for the consultant than making decisions alone,5,I would probably need further detail to fully understand ,7,It is a logical way of prioritising patients ,6,"AI is so advanced that I do trust it, but not as much as a consultant with years of medical experience ",2,8,4,8,18,2,2,3,50,0,6
213,2,2,6,1,6,This is still relatively new technology so should not be used significantly,5,I know a little about AI nbut not how it can help make decisions,5,It is a computer so can not be entirely accurate,5,AI is new and is a non-human,5,5,5,5,37,5,2,4,52,66,1
249,2,4,8,1,6,The algirithm is set uo by humans anyway so they should still keep an ooen mind,4,I don't know much about ai,7,It's a computer ,7,It's a computer ,9,7,8,8,32,5,2,2,22,55,1
376,2,2,6,1,8,"the AI is a tool, to be used as such. The Lead Officer should also use human judgement",5,the AI makes decisions based on the information given to it. It has no prior knowledge or life experience,8,"Fair, but are they just? Decisions are made based on information given. A problem with that information means an unfair decision could be made.",7,I would trust AI support but would want other decision makers to qualify,10,1,10,1,64,5,2,2,30,90,6
313,2,1,5,1,6,I think it can help but AI can't decide such things as I believe most cases will be specific,2,I have no idea the logic that built the AI,5,I would hope so but I have no idea if it is as information is limited,2,I have not seen the AI work so I can't trust it with such little information,7,9,7,9,30,5,1,3,18,71,1
466,2,1,5,1,1,Ai deal in information data. But not everything is straight forward. For example someone goes to it says i got a sore head. the might not see it as serios and say tablets. but not see the knife or stick stuck in someones head.,9,Someone in my family is a computer programmer,5,its fair as it deals with facts. but not with emotions,2,as before it only deals in logiv not emotions.,9,2,9,2,39,3,2,1,50,20,6
448,2,4,8,1,8,"The AI has been programmed to determine what is likely to give the best success rate of rehabilitation. However, I think the lead officer should have some room to override the AI if they think a different fit would be better.  ",10,"Using the information given at the start of the study, I understand the order if importance that the AI uses to make decsions",9,"From what I remember of the the order, they seemed to be fair",10,I believe it would be vary hard for someone to interfere with the AI's decision process.,2,3,2,3,27,6,2,4,30,10,6
233,1,3,3,1,4,A computer shouldnt decide who has the priority to live,10,It works with data,10,"Decisions are based on thata, without emotions",0,same like by first question,5,10,8,0,28,6,1,6,100,0,6
313,2,2,6,1,7,"I think that the AI could be suitable in informing and aiding decision making, but that it cannot be fully relied on as there are more factors at play for each indiivudal offender than just numbers and statistics and these also need to be taken into account",9,the AI uses data and neural information input to make decisions ,7,"The AI does not have human thoughts inteferring with it, so it is completely neutral. However, the AI is only making decisions based on data it is given, and cannot take into account other human factors",6,"To an extent, I trust that the AI will give an objective opinion based on data. However, every offender must also be treated as an indiviudal and their unique circumstances taken into account. decisions cannot purely by made on data trends",7,8,7,8,20,3,2,4,5,1,6
334,1,1,1,1,10,Because its a big decision to make when there is such a big back log of patients that all are a priority however more than others therefore it should be used to help make there finally decisions.,2,"not completley only been given a small piece of information , other than it helps them with what is ore urgent than others .",5,I am unsure ,5,Without knowing all information I am unsure if i would trust this or not ,5,10,10,10,24,3,2,2,50,20,7
291,1,2,2,1,8,A combination would be best,8,Based on data & algorithms,7,As long as the correct criteria is used,7,I would want some human element ,7,5,7,5,48,3,2,4,50,20,6
268,2,3,7,1,7,The AI uses a lot of available data and could be trusted to make the correct decision,7,It uses all available data to make a decision,7,The data used helps to make the right decision,7,As long as it uses the right data,5,5,5,5,30,3,1,3,80,0,6
334,1,1,1,1,6,Decisions would be made by a neutral power,1,I am just not so into Computer softwears,10,Its based on facts,10,And again the Al will make a decision just based on facts,10,9,10,10,21,2,2,1,51,0,6
444,1,3,3,1,6,"If there is a way to logically inform the consultant of who is most eligible for the treatment they should use it, but also it may cause ethical problems in terms of picking people over other patients for a treatment that everyone should be allowed to have",3,i understand which characteristics are used to inform their decisions but im still unclear how they would actually influence who is most eligible for treatment,3,as said before it could be considered unfair un using demographics and other details to prioritise certain patients,5,im not really informed on it enough to trust or not trust it,3,7,6,10,21,2,2,1,29,2,6
214,2,4,8,1,6,I think it is reasonable to take into account the AI's decision but I wouldn't entirely follow the AI because somethings only a human can detect and take into account.,9,The AI seemed to take into account a person's likelihood of reoffending based on past behavoir.,7,I think it is reasonably fair to base future decisions on past behavoir which is what the AI seemed to do.,5,I could potentially trust the AI but I would always want human oversight over anything the AI decides.,4,7,6,8,32,4,1,4,97,86,6
548,1,4,4,1,8,i agree because i feel that the AI will give a fair chance to everyone and lead to an unbiased decision by the lead consultant,5,"Well to an extend i believe that i do understand, nut if given the opportunity to ask a few questions, i would in order to fully understand",8,"the decision is based on a set rules, thus it is unbiased",8,"i do trust it, mainly cause of its fairness",9,5,10,9,25,5,2,1,71,77,1
268,1,1,1,1,4,"Artificial intelligence lacks human existence, situational expertise and morals",8,I have had a class about artificial intelligence at uni,10,It‚Äòs fair because it‚Äôs based on numbers,4,Having Maschines make decisions about human life is a possible danger,4,6,6,4,21,5,2,10,42,7,6
233,2,2,6,1,8,"Because it will give them info, although other methods should be used alongside it ",5,Only know basics,3,It does provide a full picture,4,No needs human touch too ,10,10,8,9,33,5,2,4,50,11,6
324,2,2,6,1,10,it helps with resources and with decision making,5,I have a broad knowledge but not the detail,5,impossible to say without reviewing many decisions over time,6,"slightly yes, but need to know much more and see results",3,3,3,3,54,3,1,3,31,0,6
165,2,2,6,1,8,They  are rational as they dont have feelings,8,They make decisions based on what is the correct thing to do with no bias,9,They do not have any bias as they do not have feelings or emotions,6,They may become self aware,4,7,7,8,20,3,1,1,71,71,6
253,1,2,2,1,1,We are not at the level to make use of AI in life or death situations,9,Complex algorithms are used to give AI decision making skills. this is used all the time in video games.,5,AI are designed to make it's own choices based on current information. It's hard to tell if it is fair.,5,"In a life or death situation, nothing should be left to an AI.",10,10,0,10,29,4,1,5,50,0,6
333,1,3,3,1,9,I think that it takes away the pressure on the consultant and considers many factors logically that the consultant may miss,8,i understand that the AI uses a lot of background information on the patients to decide if they should have priority for treatments,8,as it is not a human making the decision it takes away any human bias that can occur if the consultant is left to decide,7,I mostly trust the AI process but the consultants will know the patients state better,4,8,4,9,20,3,2,1,20,5,6
446,1,4,4,1,8,It takes all variables into account to make sure that those who need surgery urgently are prioritised but it still requires a human element to make sure the priorities are correct  ,9,"The ai is making decisions based on the variables such as age, weight, medication and how major the surgery is ",4,There is no bias but also no compassion for things like extenuating circumstances it just takes into account the raw data,6,I would trust the ai to prioritize patients based on the data to assist hospital staff not to make the decisions,5,8,8,9,30,5,1,5,48,9,6
192,1,4,4,1,8,AI has a clear order and eliminates factors of luck and/or bias,8,Each factor of consideration is weighted by its importance and a total calculation is made,8,There is no luck/bias element and purely based off statistical information,8,It can be reviewed and monitored to assure it all runs as it should,6,7,6,7,21,5,1,11,25,71,6
521,1,1,1,1,9,AI can tell him in blunt terms to help him decide,9,All available info is fed into AI,6,Probably not fair as it doesn't have feelings of patients' pain,6,I would if it wasn't life-threatening decisions,10,6,9,9,43,3,1,3,86,61,6
880,1,4,4,1,3,I don‚Äòt think they should rely on the AL too much for decison making because there‚Äòs many things to consider in such situations and also individually things to consider which an AL can‚Äòt really manage I believe.  But I do think that the help of an AL could be kind of useful but I would not let it take the final decision,7,"I think I do understand how it makes decisions, by calculating different things like age, sex etc. in order to select the one who needs it the most",6,I think it is kind of fair but I think that the age category should be higher in the list and also the sex should be lower. But it‚Äòs kind of hard to say which things to measure higher or decide who needs it the most because each case is individually different in my opiniom,4,Like I explained before I don‚Äòt trust the AL to do the final decision but I think it can help in making the decision by a human being,4,5,6,7,21,2,2,2,24,60,4
357,1,1,1,1,2,"AI can be useful in making decisions, particularly if it narrows down a wide variety of options into a list that is easier to pick from. However, AI can be heavily biased, and is only as neutral as it's creator. In a life or death situation this could lead to a hospital making a series of biased decisions, putting some patients as a lower priority when perhaps they should be more important. ",2,I understand that AI are often trained using example tasks until they are able to make their own decisions but this is about it.,1,AI can be biased and I have seen many examples of AI being biased against people of colour because they are made by white people (or undiverse teams) who simply do not account for people who are not themselves.,1,AI can be biased (which people can too) but people tend to consider AI as neutral when this is very often not the case.,10,5,10,5,25,5,2,9,0,0,6
451,2,4,8,1,7,not sure some of the factors should be as high as they are,10,it seems easy to follow,5,it doesnt look that fair to people who may have had a recent conviction but no threat to the society,5,not sure itll always work on the individual,10,10,10,8,27,3,2,3,50,42,6
181,1,2,2,1,7,I believe they should a mixture of advice from doctors and the AI,3,I do not understand fully,6,It is completely objective,5,May need a real human to help make an informed decision,0,10,0,10,19,3,2,8,10,1,6
239,2,2,6,1,4,I don't fully trust AI to be accurate.,1,I have not research AI too much.,2,I don't know it AIs can be accurate.,0,I don't trust them to be accurate,8,3,8,4,25,5,1,5,45,75,6
381,2,4,8,1,1,I think every case should be studied individually. I think an AI would generalize humans too much. ,7,Analyzing mostly demographical and psychological information. ,5,The categories that this AI use do make sense. However each imprisoned person should be analyzed as an individual. ,3,"The AI probably makes logical choices. However, real people should make the final decisions. ",9,8,8,9,23,2,2,6,13,6,7
700,2,3,7,1,7,"I believe that if the AI is properly programmed, it should be free of biases and be much better at decision making given the information required than humans could ever be.",4,"Not entirely. I need to see the code and it performs in action. I know the identifiers the AI takes into account for decision making, but not how the overall rating has to be for instance.",5,"It can be, but it all depends on how the AI is designed. ",7,"I absolutely do, AI helps identify areas of potential crimes ",6,3,5,3,29,5,1,2,40,30,6
458,2,3,7,1,6,"their crime and the circumstance needs to be examined but their age, sex and gender is irrelevant and unfair. ",6,the look at the individual and who they are and make their decision based off of that when they should be looking at the crime they have committed and the circumstances. ,3,"its fair if their decision is based off of the seriousness of the crime but it is extremely unfair to make decision on someone based off of their sex, gender, race, age and their financial situation and upbringing. ",1,"their decisions seem to b very unfair and excluding and it implies that only a certain group of people will be released even if their crime is more server than a black, poor, teenage boy. ",2,8,2,9,19,2,2,3,50,30,6
513,2,3,7,1,10,"The AI makes decisions in an informed and unbiased way, which people never can do 100%. However I think the final decision should still be made by the officer, since after all it is about living breathing people - there might always be things to be considered which an AI could not. However I think the AI can be and should be an important and central part of the decision making process. ",10,"The AI follows a simple algorithm, so it is clear how decisions are made",10,The AI is unbiased regarding aspects like sympathy or ehtnicity etc. ,9,"Mostly yes, but as I said in the first answer: sometimes it might be necessary to make exceptions or consider special details (this would be the expection, though) ",8,8,8,8,22,4,2,1,10,45,6
429,1,4,4,2,4,Cannot assess how trustworthy the AI is only by the information provided.,6,"Majoring in computer science, especially about ML.",6,"Kind of fair, but more of how it is coded and learned.",8,"As a computer scientist, yes.",8,6,8,6,24,5,1,1,20,70,5
610,2,3,7,1,7,I think the AI would be useful because the decisions made  will be based on facts not opinions,8,The AI will make decisions by using all the data presented to it and choosing the offenders who are most likely not to reoffend with extra help,7,I think it is mostly fair because its decisions are made using facts not personal opinions or bias,8,Yes it has no alterior motives,4,5,4,8,40,2,2,6,40,9,6
174,1,3,3,1,8,"Precision and accuracy, unbiased.",6,"Moderate understanding of AI and algorithms, ",10,"Unbiased, not affected by feelings, just behaves according to how it has been coded to behave.",7,"Yes, so long as the programmer is competent.",10,1,7,7,23,5,1,12,50,25,6
